{
    "keyword": "expat health insurance",
    "language": "en",
    "country": "US",
    "results": [
        {
            "position": 2,
            "title": "Expat Health Insurance",
            "url": "https://www.imglobal.com/expat-insurance",
            "domain": "www.imglobal.com",
            "snippet": "IMG's expat health insurance plans have solutions for physical health, mental wellness, financial protection, crisis support, and personal property."
        },
        {
            "position": 3,
            "title": "Expat Health Insurance for Professionals",
            "url": "https://www.allianzcare.com/en/personal-international-health-insurance/who-we-help/professionals.html",
            "domain": "www.allianzcare.com",
            "snippet": "Expatriate Health Insurance provides medical coverage for professionals called expats who reside in a foreign country for a prolonged period usually for work- ... Read more"
        },
        {
            "position": 4,
            "title": "Expat Medical/Health Insurance",
            "url": "https://www.reddit.com/r/expats/comments/1guescz/expat_medicalhealth_insurance/",
            "domain": "www.reddit.com",
            "snippet": "Are there any expat health insurance companies that aren't horrible? Cignaglobal, IMG, Geoblue all have HORRIBLE online ratings. Read more"
        },
        {
            "position": 6,
            "title": "Expat health insurance",
            "url": "https://www.axaglobalhealthcare.com/en/expat-health-insurance/",
            "domain": "www.axaglobalhealthcare.com",
            "snippet": "Get an expat health insurance quote with AXA. We provide flexible medical cover around the world. 5 levels of cover,"
        },
        {
            "position": 7,
            "title": "Do I Need Health Insurance Living Abroad? Expat Guide",
            "url": "https://www.greenbacktaxservices.com/blog/expat-health-insurance/",
            "domain": "www.greenbacktaxservices.com",
            "snippet": "Apr 16, 2026 — Expat health insurance costs vary significantly based on your age, location, coverage level, and whether the plan includes the U.S. According to ... Read more"
        },
        {
            "position": 8,
            "title": "Global Expat Health Insurance Explained",
            "url": "https://www.cignaglobal.com/resources/expat-health-insurance-explained",
            "domain": "www.cignaglobal.com",
            "snippet": "Expat health insurance is an inclusive safety net for you and your family to live your life abroad without restriction."
        },
        {
            "position": 9,
            "title": "AARO Health Insurance Plan for Expat Americans",
            "url": "https://aaro.org/health-insurance/health-insurance-plan",
            "domain": "aaro.org",
            "snippet": "AARO provides a reasonably-priced health care plan for Americans living abroad. Available in most countries, the plan provides special features for expat ..."
        },
        {
            "position": 10,
            "title": "International Health Insurance Coverage for Living Abroad",
            "url": "https://www.internationalinsurance.com/health/?srsltid=AfmBOopw9_rvUvMxfufF1HVYW7po0loXhynJUfwi7z2z_u9kvhjwRUd5",
            "domain": "www.internationalinsurance.com",
            "snippet": "Jul 9, 2026 — The average annual cost of an international medical insurance plan is about $6,900. Annual plan pricing varies widely, from under $500 for ..."
        },
        {
            "position": 11,
            "title": "Expatriate health insurance in the United States",
            "url": "https://www.international-sante.com/healthforexpats/expat-insurance/country/united-states/",
            "domain": "www.international-sante.com",
            "snippet": "Buying expatriate healthcare insurance is essential in the US, where a trip to the emergency room costs between $ 1,000 and $ 4,000, and appendicitis between $ ... Read more"
        }
    ]
}