{
    "keyword": "nurse malpractice insurance",
    "language": "en",
    "country": "US",
    "results": [
        {
            "position": 2,
            "title": "NSO: Nurses Service Organization - Nursing Malpractice ...",
            "url": "https://www.nso.com/",
            "domain": "www.nso.com",
            "snippet": "If you're looking for nursing malpractice insurance, NSO insurance can give you a fast and easy quote. Find out more about nursing liability insurance."
        },
        {
            "position": 5,
            "title": "ANA Membership Personal Benefits - Insurance & more",
            "url": "https://www.nursingworld.org/membership/member-benefits/personal-benefits/",
            "domain": "www.nursingworld.org",
            "snippet": "Nurses need to protect themselves and their career by maintaining Professional Liability Insurance, a.k.a. Medical Malpractice Insurance."
        },
        {
            "position": 6,
            "title": "Nurse Professional Liability Insurance Stay Covered While ...",
            "url": "https://www.proliability.com/healthcare/healthcare-professionals/nurses/",
            "domain": "www.proliability.com",
            "snippet": "With Proliability, you get affordable coverage designed specifically for nurses, with premiums starting at just $106 for employed RNs.*"
        },
        {
            "position": 7,
            "title": "To Have or Not to Have Malpractice/Liability Insurance",
            "url": "https://mnnurses.org/to-have-or-not-to-have-malpractice-liability-insurance/",
            "domain": "mnnurses.org",
            "snippet": "Dec 5, 2018 — Professional malpractice insurance, through Nurses Service Organization (NSO), for instance will pay up to $25,000 for a Board of Nursing ... Read more"
        },
        {
            "position": 8,
            "title": "Insurance for Nurses | CNA",
            "url": "https://www.cna.com/industries/affinity/nurses",
            "domain": "www.cna.com",
            "snippet": "As the country's leading underwriter for nursing professionals, we provide malpractice insurance for individuals and small groups of nurses."
        },
        {
            "position": 9,
            "title": "Nurse Malpractice and Liability Insurance",
            "url": "https://www.berxi.com/insurance/all-nurses/",
            "domain": "www.berxi.com",
            "snippet": "Nursing malpractice insurance for LPNs, LVNs, and RNs typically starts at around $68 per year. Typical limits of liability range from $500,000 per claim/$1 ..."
        },
        {
            "position": 10,
            "title": "Professional Liability Insurance",
            "url": "https://www.nasn.org/membership/benefits/liability-insurance",
            "domain": "www.nasn.org",
            "snippet": "Professional Liability Insurance – up to $1 million per claim ($6 million aggregate per year) Phone: 1-800-247-1500. Telephone: 240-821-1130"
        },
        {
            "position": 11,
            "title": "Ask A Nurse: What Is Personal Liability Insurance And ...",
            "url": "https://nursejournal.org/ask-a-nurse/do-i-need-personal-liability-insurance/",
            "domain": "nursejournal.org",
            "snippet": "Nov 4, 2024 — It is a type of insurance that protects you from claims brought against you and the service you provide as a nurse. According to the Nurses ... Read more"
        }
    ]
}