{
  "keyword": "consultant professional liability insurance",
  "language": "en",
  "country": "US",
  "results": [
    {"position": 1, "title": "Business Consultant Insurance Professional & General Liability | Hiscox", "url": "https://www.hiscox.com/small-business-insurance/professional-business-insurance/business-consultant-insurance", "domain": "www.hiscox.com", "snippet": "Hiscox describes professional liability insurance for business consultants as protection against claims of negligence and judgment errors arising from professional services."},
    {"position": 2, "title": "Professional Liability Insurance for Consultants | The Hartford", "url": "https://www.thehartford.com/professional-liability-insurance/consultants", "domain": "www.thehartford.com", "snippet": "The Hartford explains that consultant professional liability insurance can help cover legal fees and defense costs and can also help pay covered settlements and judgments."},
    {"position": 3, "title": "Independent Consultant/Non-Specialist Professional Services Providers | Cornell", "url": "https://www.risk.cornell.edu/vendor-provider-main-page/consultant-or-non-specialist/", "domain": "www.risk.cornell.edu", "snippet": "Cornell's risk guidance says professional liability coverage for consultants can address claims involving negligence, personal injury such as libel and slander, work completed in the past, and employees or independent contractors."},
    {"position": 4, "title": "Professional Liability Insurance FAQs | The Hartford", "url": "https://www.thehartford.com/professional-liability-insurance/faq", "domain": "www.thehartford.com", "snippet": "The Hartford explains that professional liability insurance can help protect a business when a client claims that a mistake in professional services caused a financial loss."},
    {"position": 5, "title": "Professional Liability (Errors & Omissions) Insurance for Consultants | Insureon", "url": "https://www.insureon.com/consulting-business-insurance/professional-liability", "domain": "www.insureon.com", "snippet": "Insureon says the cost of professional liability insurance depends on factors including the services offered, revenue, coverage limits, and other business risks."}
  ]
}
