{
    "keyword": "consultant professional liability insurance",
    "language": "en",
    "country": "US",
    "results": [
        {
            "position": 2,
            "title": "New independent consultant - Liability Insurance?",
            "url": "https://www.reddit.com/r/consulting/comments/16g70yy/new_independent_consultant_liability_insurance/",
            "domain": "www.reddit.com",
            "snippet": "I’m retired and just started doing some independent consulting. In a short time I’ve picked up several clients and will likely have annual revenues ..."
        },
        {
            "position": 3,
            "title": "Business Consultant Insurance Professional & General ...",
            "url": "https://www.hiscox.com/small-business-insurance/professional-business-insurance/business-consultant-insurance",
            "domain": "www.hiscox.com",
            "snippet": "Hiscox business consultant insurance protects against negligence and liability claims. Get a fast, free quote on coverage for your professional needs."
        },
        {
            "position": 5,
            "title": "Professional Liability Insurance for Consultants",
            "url": "https://www.thehartford.com/professional-liability-insurance/consultants",
            "domain": "www.thehartford.com",
            "snippet": "Feb 24, 2025 — Professional liability insurance can help cover your legal fees and costs to defend your business. It can also help pay for settlements and ..."
        },
        {
            "position": 6,
            "title": "Business Consultant Insurance: What You Need, Best ...",
            "url": "https://www.nerdwallet.com/business/insurance/best/consultants",
            "domain": "www.nerdwallet.com",
            "snippet": "Professional liability insurance for consulting companies has a median price of $883 per year, according to data that insurance agency Coverdash shared with ... Read more"
        },
        {
            "position": 7,
            "title": "Independent Consultant/Non-Specialist Professional Services ...",
            "url": "https://www.risk.cornell.edu/vendor-provider-main-page/consultant-or-non-specialist/",
            "domain": "www.risk.cornell.edu",
            "snippet": "The insurance can cover the following: Negligence; Personal Injury (Libel & Slander); Claims for work that was completed in the past; employees and independent ... Read more"
        },
        {
            "position": 8,
            "title": "Consulting Insurance",
            "url": "https://www.progressivecommercial.com/business-insurance/professions/consulting-insurance/",
            "domain": "www.progressivecommercial.com",
            "snippet": "Professional Liability. This essential coverage for consultants protects if you're sued for negligence related to your professional services. · Commercial Auto. Read more"
        },
        {
            "position": 9,
            "title": "Consultant Liability Insurance: 7 Things to Know",
            "url": "https://ctlowndes.com/blog/business-insurance-for-consultants/",
            "domain": "ctlowndes.com",
            "snippet": "Mar 28, 2026 — Consultant liability insurance helps protect against claims, legal costs, and financial losses tied to being sued for an error. Read more"
        },
        {
            "position": 10,
            "title": "Do Consultants Need Professional Liability Insurance?",
            "url": "https://www.nerdwallet.com/business/insurance/learn/do-consultants-need-professional-liability-insurance",
            "domain": "www.nerdwallet.com",
            "snippet": "Apr 16, 2026 — Professional liability insurance protects consultants who are sued for mistakes or misinformation. Professional liability insurance covers ..."
        },
        {
            "position": 11,
            "title": "What's The Best Business Insurance For Consultants?",
            "url": "https://www.nextinsurance.com/blog/best-business-insurance-for-consultants/",
            "domain": "www.nextinsurance.com",
            "snippet": "Sep 17, 2025 — Professional liability insurance (also called errors and omissions insurance, or E&O): For claims and allegations of bad advice, professional ... Read more"
        }
    ]
}